Title,Content,Link,Sentiment Score,Sentiment
"Arthur Hayes Predicts Bitcoin Bottom at $70K, Sees Strong Bull Market Ahead","Bitcoin could drop to $70000 before its next rally, Arthur Hayes predicts, emphasizing patience. He warns of short-term volatility and highlights central...",https://news.bitcoin.com/arthur-hayes-predicts-bitcoin-bottom-at-70k-sees-strong-bull-market-ahead/&ved=2ahUKEwigrZadvoOMAxXikIkEHRjyOBMQxfQBegQIBRAC&usg=AOvVaw1zjirg9tAId_V5JO8_Up4m,0.0,Neutral
Dollar’s Decline and Yield Crash: QCP Reveals Hidden Lifeline for Battered Risk Assets,QCP Capital highlights a stark reversal in post-election market optimism as equities and crypto face historic sell-offs.,https://news.bitcoin.com/dollars-decline-and-yield-crash-qcp-reveals-hidden-lifeline-for-battered-risk-assets/&ved=2ahUKEwigrZadvoOMAxXikIkEHRjyOBMQxfQBegQIChAC&usg=AOvVaw1oDLMhL9p3icIeEUQAB2QP,-0.1,Neutral
The United States Must Embrace Bitcoin Now: A Recap Of Bitcoin For America,Speakers at the Bitcoin Policy's Institute's Bitcoin For America event made the case that it's time for the United States to lead the way when it comes to...,https://bitcoinmagazine.com/news/the-united-states-must-embrace-bitcoin-now-a-recap-of-bitcoin-for-america&ved=2ahUKEwigrZadvoOMAxXikIkEHRjyOBMQxfQBegQIARAC&usg=AOvVaw1hHyp68VU1v4df5U_hl8af,0.0,Neutral
Bitcoin Price Crash: 6 Key Events To Watch Out For In Crypto This Week | Bitcoinist.com,"After weeks of strong performance, Bitcoin's recent price crash has raised concerns about further downside and the start of the bear market.",https://bitcoinist.com/key-events-to-impact-bitcoin/&ved=2ahUKEwigrZadvoOMAxXikIkEHRjyOBMQxfQBegQIBhAC&usg=AOvVaw2HktSz4UTYAy7vFbF3V8B0,0.14444444444444446,Positive
Puerto Rico Court Fines Man $10K Daily for Refusing to Surrender 119 Bitcoin,A federal court in Puerto Rico has held Juan Carlos Reynoso in contempt for refusing to surrender 119.65 BTC.,https://news.bitcoin.com/puerto-rico-court-fines-man-10k-daily-for-refusing-to-surrender-119-bitcoin/&ved=2ahUKEwigrZadvoOMAxXikIkEHRjyOBMQxfQBegQIBxAC&usg=AOvVaw2kLeEGsPXJfR0VVwkxCHkY,0.0,Neutral
The US Government Is One Step Closer To Buying 1 Million Bitcoin,"Republican Senator Lummis has reintroduced her bill to establish a strategic Bitcoin reserve, taking a legislative path towards President Trump's plan for...",https://zycrypto.com/the-us-government-is-one-step-closer-to-buying-1-million-bitcoin/&ved=2ahUKEwigrZadvoOMAxXikIkEHRjyOBMQxfQBegQIAhAC&usg=AOvVaw0g5eIeqTqpq4XyO93sZaim,0.0,Neutral
"Bitcoin, XRP and Solana Bounce Back After Crypto Market Bloodbath",Bitcoin and other top crypto assets are rising again after getting hit hard by President Trump's tariff twists and recession fears.,https://decrypt.co/309570/bitcoin-xrp-solana-bounce-back-bloodbath&ved=2ahUKEwigrZadvoOMAxXikIkEHRjyOBMQxfQBegQICRAC&usg=AOvVaw1SbzCOgTCkziCHNyDy9xpf,0.027777777777777773,Neutral
"Michael Saylor urges the US to buy Bitcoin, similar to its historic land purchases",Bitcoin maximalist Michael Saylor believes Bitcoin is as valuable as land and the US should purchase the “digital gold” as it had purchased land in the...,https://www.thestreet.com/crypto/markets/michael-saylor-urges-the-us-to-buy-bitcoin&ved=2ahUKEwigrZadvoOMAxXikIkEHRjyOBMQxfQBegQIBBAC&usg=AOvVaw3qsxXfHoaUW0i_rKY6Azym,0.0,Neutral
"How Will the US Bitcoin Reserve Work, Exactly?","With a March 6 executive order, President Donald Trump created a strategic Bitcoin reserve, effectively entrenching Bitcoin's legitimacy as a mainstream...",https://www.bloomberg.com/news/articles/2025-03-11/how-will-trump-s-us-strategic-bitcoin-reserve-work&ved=2ahUKEwigrZadvoOMAxXikIkEHRjyOBMQxfQBegQIAxAC&usg=AOvVaw0EYjDFeGVYnOCvimo6GC8X,0.6,Positive
"Bitcoin 'Heading Toward' $73K Amid Macro Headwinds, Meme Coin Swoon: 10X Research","10x Research's Bitcoin report noted parallels between the end of the previous bull market and current conditions, including macroeconomic uncertainty.",https://decrypt.co/309547/bitcoin-heading-toward-73k-10x-research&ved=2ahUKEwigrZadvoOMAxXikIkEHRjyOBMQxfQBegQICBAC&usg=AOvVaw1UGkcij-3Zhsiw64pUBVEH,-0.08333333333333333,Neutral
